{
  "schema_version": "egia-quest.contenido.dilemas.v0.1.0",
  "estado": "borrador para revisión humana",
  "fecha": "2026-08-29",
  "sirve_a": "Fase 1 del Plan de Fases y Gates v0.2.0 · DEC-EGIA-026 · paga DEUDA-EGIA-006",
  "subjetividad_estrategica": "estudiante universitario de educación general",
  "nota_autoria": "Borrador redactado con asistencia de IA. La autoría, la revisión y la aprobación son humanas.",
  "principio": "Ninguna opción se puntúa como correcta. Cada opción muestra su consecuencia, y donde hubo daño se ofrece reparación. La calidad de la decisión se registra para el tablero, no se le muestra a la persona como nota.",
  "herencia": "D-003, D-005 y D-007 desarrollan los tres dilemas del MVP v0.1A, que eran de opción única sin consecuencia.",
  "dilemas": [
    {
      "id": "EGIA-D-001",
      "titulo": "El disclosure que nadie te pidió",
      "nivel": "Q0",
      "eje_ibata": "accountability",
      "practica_relacionada": 1,
      "competencias": ["agencia_humana", "literacidad_ia"],
      "sensibilidad": "media",
      "escenario": "Terminas un ensayo para un curso donde la profesora nunca mencionó la IA. Usaste un modelo para reorganizar tus párrafos y afinar tres transiciones. El resto es tuyo. Nadie te pidió declarar nada, y el formulario de entrega no tiene ninguna casilla para eso.",
      "pregunta": "¿Qué haces con la declaración?",
      "opciones": [
        {
          "id": "a",
          "texto": "Entrego sin declarar nada: no me lo pidieron.",
          "calidad": "evasiva",
          "consecuencia": "La entrega pasa sin incidentes. Semanas después la profesora anuncia una política de declaración y pide revisar trabajos anteriores. Ahora declararlo se ve como una confesión tardía, no como una práctica.",
          "reparacion": "Escribir a la profesora antes del anuncio, no después, explicando lo que hiciste. Cuanto antes llegue, menos parece defensa."
        },
        {
          "id": "b",
          "texto": "Añado un párrafo de disclosure al final aunque nadie lo pida.",
          "calidad": "cuidadosa",
          "consecuencia": "La profesora lo lee, te pregunta en clase cómo lo hiciste y termina usando tu párrafo como ejemplo. Tu trabajo se vuelve legible como proceso, no solo como resultado.",
          "reparacion": null
        },
        {
          "id": "c",
          "texto": "Le pregunto primero a la profesora qué espera.",
          "calidad": "cuidadosa",
          "consecuencia": "Te contesta que aún no tiene política y te agradece la pregunta. Queda constancia de que preguntaste antes, que es lo que protege una duda de convertirse en problema.",
          "reparacion": null
        },
        {
          "id": "d",
          "texto": "Quito las transiciones que sugirió el modelo para no tener que declarar nada.",
          "calidad": "apresurada",
          "consecuencia": "El ensayo queda peor y sigues sin declarar el uso, porque el modelo también te ayudó a reorganizar. Evitar la declaración te costó calidad y no resolvió el fondo.",
          "reparacion": "Restaurar las transiciones y declarar el uso completo, incluida la reorganización."
        }
      ],
      "reflexion_posterior": "¿Qué te habría hecho declarar sin dudarlo? Nombrar eso te dice qué necesitas para que declarar sea automático.",
      "puntos_base": 5
    },
    {
      "id": "EGIA-D-002",
      "titulo": "La cita perfecta que no aparece",
      "nivel": "Q1",
      "eje_ibata": "injusticias_danos",
      "practica_relacionada": 3,
      "competencias": ["literacidad_ia", "evaluacion_criterio"],
      "sensibilidad": "media",
      "escenario": "Entregas mañana a las ocho. La IA te dio una referencia que encaja perfecto con tu argumento: autora, año, revista, número de páginas. Llevas cuarenta minutos buscándola y no existe en ninguna base. El resto del trabajo está listo.",
      "pregunta": "¿Qué haces con la cita?",
      "opciones": [
        {
          "id": "a",
          "texto": "La dejo: encaja, y probablemente exista en algún sitio que no busqué.",
          "calidad": "dañina",
          "consecuencia": "La profesora intenta consultarla para su propia investigación y no la encuentra. Tu trabajo pierde credibilidad entero, no solo esa línea: si una referencia es inventada, todas quedan bajo sospecha.",
          "reparacion": "Escribir de inmediato retirando la cita y explicando cómo llegó ahí, antes de que te lo pregunten."
        },
        {
          "id": "b",
          "texto": "La quito y reescribo el argumento con las fuentes que sí verifiqué.",
          "calidad": "cuidadosa",
          "consecuencia": "El argumento queda más modesto y sostenido. Entregas cuarenta minutos más tarde de lo previsto y con una afirmación menos, pero todo lo que afirmas se puede comprobar.",
          "reparacion": null
        },
        {
          "id": "c",
          "texto": "La dejo con una nota: «referencia sugerida por IA, no verificada».",
          "calidad": "apresurada",
          "consecuencia": "La honestidad se agradece, pero una referencia no verificada no sostiene un argumento. Te la devuelven pidiendo que reescribas esa sección igual, ahora con menos tiempo.",
          "reparacion": "Reescribir la sección apoyándola en fuentes verificadas."
        },
        {
          "id": "d",
          "texto": "Busco una fuente real que diga algo parecido y la sustituyo.",
          "calidad": "cuidadosa",
          "consecuencia": "Encuentras una que dice algo parecido pero no idéntico, y al ajustar tu frase descubres que tu afirmación original era más fuerte de lo que la evidencia permite. El trabajo mejora.",
          "reparacion": null
        }
      ],
      "reflexion_posterior": "¿Qué hacía tan creíble esa cita? Lo que te convenció a ti es lo que convencerá a otros la próxima vez.",
      "puntos_base": 5
    },
    {
      "id": "EGIA-D-003",
      "titulo": "Las respuestas de tus compañeros",
      "nivel": "Q2",
      "eje_ibata": "injusticias_danos",
      "practica_relacionada": 6,
      "competencias": ["etica_responsabilidad"],
      "sensibilidad": "alta",
      "escenario": "Tu grupo hizo una encuesta en clase sobre hábitos de estudio. Tienen cuarenta respuestas abiertas, algunas con nombres, una con una situación familiar difícil. Analizar eso a mano toma horas y el análisis con IA tomaría minutos.",
      "pregunta": "¿Qué haces con las respuestas?",
      "opciones": [
        {
          "id": "a",
          "texto": "Las pego tal cual: son de clase, no son datos médicos.",
          "calidad": "dañina",
          "consecuencia": "La respuesta con la situación familiar difícil sale del control del grupo y queda en un servicio externo. Nadie se entera, y eso es precisamente el problema: la persona que la escribió confió en un contexto de clase.",
          "reparacion": "No hay forma de recuperar lo enviado. Lo que sí procede es avisar al grupo, revisar los términos del servicio y no volver a hacerlo."
        },
        {
          "id": "b",
          "texto": "Anonimizo, quito lo identificable y proceso el resto.",
          "calidad": "cuidadosa",
          "consecuencia": "El análisis sale igual de útil. Te toma veinte minutos preparar los datos, y en el proceso descubres dos respuestas que no habías leído con atención.",
          "reparacion": null
        },
        {
          "id": "c",
          "texto": "Analizo a mano y no uso IA para nada de esto.",
          "calidad": "cuidadosa",
          "consecuencia": "Tardas tres horas y el análisis es más fino de lo que habría salido automático, porque leíste cada respuesta. La abstención tiene costo y también rendimiento.",
          "reparacion": null
        },
        {
          "id": "d",
          "texto": "Uso solo las respuestas cortas y sin nombres, y descarto las largas.",
          "calidad": "apresurada",
          "consecuencia": "Proteges los datos sensibles, pero sesgas el análisis: las respuestas largas eran justo las de quienes tenían más que decir. Tu conclusión representa a quien escribió poco.",
          "reparacion": "Recuperar las respuestas largas anonimizadas y rehacer el análisis, o declarar el sesgo en el informe."
        }
      ],
      "reflexion_posterior": "La respuesta con la situación familiar difícil: ¿qué habría querido esa persona que hicieras?",
      "puntos_base": 10
    },
    {
      "id": "EGIA-D-004",
      "titulo": "El compañero que no declaró",
      "nivel": "Q2",
      "eje_ibata": "accountability",
      "practica_relacionada": 4,
      "competencias": ["colaboracion_transdisciplinaria", "agencia_humana"],
      "sensibilidad": "media-alta",
      "escenario": "Trabajo de grupo, entrega en dos días. La sección de un compañero llega escrita en un registro que no es el suyo, con ejemplos genéricos y sin una sola referencia local. Tú declaraste tu uso de IA en tu parte. Él no declaró nada.",
      "pregunta": "¿Qué haces?",
      "opciones": [
        {
          "id": "a",
          "texto": "Lo hablo con él antes de entregar.",
          "calidad": "cuidadosa",
          "consecuencia": "Admite que lo generó entero porque iba corto de tiempo. Entre los dos lo reescriben con sus ejemplos y añaden su declaración. La entrega se retrasa unas horas y el grupo llega íntegro.",
          "reparacion": null
        },
        {
          "id": "b",
          "texto": "Entrego así: es su sección y su responsabilidad.",
          "calidad": "evasiva",
          "consecuencia": "La entrega es del grupo, no de cada uno. La observación llega al grupo entero y tu declaración cuidadosa queda mezclada con la ausencia de la suya.",
          "reparacion": "Explicar al docente lo que ocurrió, después de haberlo hablado con tu compañero, no en lugar de eso."
        },
        {
          "id": "c",
          "texto": "Se lo digo al docente directamente.",
          "calidad": "apresurada",